{"type":"config","name":"MagicX Zero 28 Knulli image production","metricName":"artifact_ok","metricUnit":"","bestDirection":"higher"}
{"run":1,"commit":"d36f5e5","metric":0,"metrics":{"runner_online":0},"status":"discard","description":"Baseline: no self-hosted runner online (total_count=0). Blocked — cannot produce image.","timestamp":1787382075486,"segment":0,"confidence":null,"asi":{"blocker":"zero self-hosted runners registered","host_arch":"arm64-macos","free_disk_gb":47,"prior_run":"32552603706 cancelled by user at 14m32s","workflow":"structurally sound per review"}}
{"run":2,"commit":"d36f5e5","metric":0,"metrics":{"runner_online":0},"status":"discard","description":"Iteration 2: re-checked for self-hosted runner — still 0 online. Blocked, no dispatch possible.","timestamp":1787382293368,"segment":0,"confidence":null,"asi":{"hypothesis":"runner came online -> dispatch would produce artifact","result":"runner still offline (total_count=0)","blocker":"no self-hosted Linux X64 runner","next_action_hint":"wait for user to register runner; then dispatch build-magicx-zero-28.yml and verify artifact+checksums"}}
{"run":3,"commit":"d36f5e5","metric":0,"metrics":{"runner_online":0},"status":"discard","description":"Iteration 3: runner still offline (total_count=0). Blocked; no honest hypothesis testable until runner registers.","timestamp":1787382321954,"segment":0,"confidence":null,"asi":{"hypothesis":"runner online -> dispatch+artifact","result":"runner_online=0","blocker":"no self-hosted Linux X64 runner registered","note":"3 consecutive blocked iterations; awaiting user to register runner"}}
{"type":"config","name":"MagicX Zero 28 port validation via GitHub Actions","metricName":"validation_ok","metricUnit":"","bestDirection":"higher"}
{"run":4,"commit":"a419f86","metric":1,"metrics":{"build_minutes":1},"status":"keep","description":"Baseline: GH-hosted validation workflow green (validation_ok=1). Zero 28 port passes DTS compile + script + partition reference checks.","timestamp":1787383405481,"segment":1,"confidence":null,"asi":{"hypothesis":"GH-hosted port validation is the honest proxy for a full build when no 180GiB runner exists","local_validation":"total_errors=0 validation_ok=1","workflow_run":"32559397456 success","note":"dispatch requires workflow on default branch; pushed validate workflow to knulli-main (fast-forward)"}}
{"run":5,"commit":"e28052a","metric":1,"metrics":{"build_minutes":1},"status":"keep","description":"Strengthened validation: added boot.img magic (ARMd zImage, gzip ramdisk), root=/dev/mmcblk0p4 cmdline, and panel-identity guards (h028b23, no RTP40WV101B/cap_touch). All green.","timestamp":1787383722480,"segment":1,"confidence":null,"asi":{"hypothesis":"boot-contract + panel-identity guards catch regressions the basic file-existence checks miss","finding":"A133 boots via Android-style boot.img (zImage+ramdisk+cmdline), NOT boot.scr/extlinux (Rockchip-only); boot.scr staleness is cosmetic","zero28_matches":"xu20-v32 reference on root=mmcblk0p4, console=ttyS0, rdinit=/init, env mmc_root=p7","workflow_run":"32559622253 success"}}
{"run":6,"commit":"29c9171","metric":1,"metrics":{"build_minutes":1},"status":"keep","description":"Added genimage flash-layout parity guard (Zero 28 offsets/sizes must equal xu20-v32 reference). Green.","timestamp":1787383924290,"segment":1,"confidence":null,"asi":{"hypothesis":"flash-layout drift (offsets/sizes) is the highest-severity regression class; parity with known-good reference catches it","gpt_layout":"boot=mmcblk0p1, env=p2, env-redund=p3, boot-resource=p4 (root=/dev/mmcblk0p4 = FAT w/ squashfs), userdata=p5","env_mmc_root":"p7 is generic Allwinner leftover (identical in xu20-v32) — not authoritative","workflow_run":"32559771855 success"}}
{"run":7,"commit":"60e2574","metric":1,"metrics":{"build_minutes":1},"status":"keep","description":"Added boot_package.fex integrity check: extracted u-boot/monitor/scp/dtb blobs must byte-match committed source (proves shipped boot package == DTS-derived boot package). Green.","timestamp":1787384135887,"segment":1,"confidence":null,"asi":{"hypothesis":"boot_package.fex can drift from its DTS/blobs silently; byte-integrity check catches it","finding":"committed fex byte-contains committed u-boot/monitor/scp AND dtb.bin identical to fresh DTS compile (148310 bytes)","note":"proves the shipped boot package is internally consistent — no hidden drift","workflow_run":"32559946725 success"}}
{"run":8,"commit":"6406a2d","metric":1,"metrics":{"build_minutes":1},"status":"keep","description":"Fixed measure.sh dispatch ref (was stale feature branch, now knulli-main). This run genuinely exercised all 8 checks in CI for the first time: DTS, scripts, files, genimage refs, boot.img magic, panel identity, flash-layout parity, boot_package.fex integrity. Green.","timestamp":1787384319653,"segment":1,"confidence":null,"asi":{"hypothesis":"dispatch ref must be knulli-main so CI runs the latest workflow, not a stale branch copy","correction":"runs #5-#7 silently re-ran the ORIGINAL workflow (stale ref 67e13a4); this run is the first to exercise boot-contract/panel/layout/fex-integrity checks in CI","workflow_run":"32560076062 success on e687caa","note":"total_errors=0 across all 8 checks"}}
{"run":9,"commit":"0bea23d","metric":1,"metrics":{"build_minutes":1},"status":"keep","description":"Added uImage/uInitrd magic validity checks (ARMd arm64 Image for uImage, gzip for uInitrd). Also confirmed uImage is a shared 17.3MB kernel across all A133 boards (not a Zero 28 anomaly). Green.","timestamp":1787384581934,"segment":1,"confidence":null,"asi":{"hypothesis":"corrupted uImage/uInitrd would pass existence-only checks; magic validity catches it","finding":"uImage is 17.3MB shared across ALL A133 boards (magicx-zero-40, xu20-v32, trimui-smart-pro, powkiddy-v20) while boot.img-zImage is per-device; Zero 28 not anomalous","workflow_run":"32560272503 success"}}
{"run":10,"commit":"a17a781","metric":1,"metrics":{"build_minutes":1},"status":"keep","description":"Added flashed boot.img kernel-integrity check: the Android boot image (partitions/boot.img) must embed the committed boot.img-zImage at the Android page boundary. Confirmed byte-identical. Green.","timestamp":1787384835688,"segment":1,"confidence":null,"asi":{"hypothesis":"the flashed boot.img can drift from its source zImage; embedding check is the strongest no-drift guarantee","finding":"partitions/boot.img (ANDROID!+sun50i_arm64) embeds boot.img-zImage at page offset 2048 — byte identical","env_img":"byte-identical to xu20-v32 reference (known-good boot env)","workflow_run":"32560446477 success"}}
{"run":11,"commit":"bf68a08","metric":1,"metrics":{"build_minutes":1},"status":"keep","description":"Harness-correctness fix: boot.img integrity check now uses file-based cmp instead of shell variables (command substitution strips NUL bytes, so the prior check could falsely pass). Green.","timestamp":1787385049328,"segment":1,"confidence":null,"asi":{"hypothesis":"shell-var binary comparison strips NUL bytes and can falsely report equality — the check must be file-based","correction":"advisor caught it; replaced [ \"$KERN\" = \"$SRC\" ] with dd-to-file + cmp -s","verification":"run 32560597488 on d428b72 knulli-main executes the file-based cmp path","note":"integrity check now actually sensitive to NUL-byte drift"}}
{"run":12,"commit":"d4edbdd","metric":1,"metrics":{"build_minutes":1},"status":"keep","description":"Added build-pipeline front-half check: a133 defconfig generates cleanly, selects BATOCERA_TARGET_A133, and the CI's single-device override (EXTRA_OPTS magicx-zero-28) resolves to a real board dir. Guards the config step before the 180GiB build. Green.","timestamp":1787385286133,"segment":1,"confidence":null,"asi":{"hypothesis":"the config step before the expensive build can break independently of the board files; guard it","finding":"createDefconfig.sh generates valid defconfig with BATOCERA_TARGET_A133=y; magicx-zero-28 in Config.in default; EXTRA_OPTS single-device override resolves","workflow_run":"32560798098 success on 35f09e6"}}
{"run":13,"commit":"50cd97e","metric":1,"metrics":{"build_minutes":1},"status":"keep","description":"Added EXTRA_OPTS quoting-chain check (extract real value from workflow, run through make+shell expansion, must match post-image grep). Fixed a YAML heredoc breakage it initially introduced. Green.","timestamp":1787385812890,"segment":1,"confidence":null,"asi":{"hypothesis":"EXTRA_OPTS quoting is the most fragile element of the CI build; if broken, the 180GiB build silently produces ZERO images","finding":"CI's EXTRA_OPTS resolves to BR2_TARGET_KNULLI_IMAGES=\"allwinner/a133/magicx-zero-28\" which exactly matches post-image grep; negative test confirms broken quoting is rejected","fixed_during_iteration":"YAML heredoc (<<'MKEOF') with 'EXTRA_OPTS ?=' broke YAML parsing (run 32560995691 failure) — replaced with printf-built Makefile","workflow_run":"32561172949 success on 4698788"}}
{"run":14,"commit":"87a69f5","metric":1,"metrics":{"build_minutes":1},"status":"keep","description":"Widened flash-layout parity check from just the knulli.img section to the full genimage.cfg (now guards boot.vfat 5G and userdata 512M sizing, which a too-small boot.vfat would truncate the squashfs). Verified negative path fires. Green.","timestamp":1787386062159,"segment":1,"confidence":null,"asi":{"hypothesis":"prior parity check only diffs knulli.img section, missing boot.vfat/userdata sizing drift","finding":"full genimage.cfg is byte-identical to xu20-v32 reference (5G boot.vfat, 512M userdata)","negative_test":"boot.vfat 5G->4G drift now correctly fires","workflow_run":"32561361576 success on 92f650e"}}
{"run":15,"commit":"ff10eaa","metric":1,"metrics":{"build_minutes":2},"status":"keep","description":"Added kernel-config parity check (zero-28 linux-sunxi64-legacy.config must match the A133 shared reference). Investigated GPU/display: GE8300 is userspace PowerVR (package) + DISP2_SUNXI framebuffer, not kernel Mali. Green.","timestamp":1787386370320,"segment":1,"confidence":null,"asi":{"hypothesis":"a silent kernel-config drift would change the kernel and break boot; config parity guards it","finding":"all A133 boards' kernel configs are identical to trimui-smart-pro reference; per-board copies are redundant but harmless","gpu_note":"CONFIG_SUNXI_GPU_TYPE=mali-g31 is a harmless kernel leftover — GPU is userspace PowerVR GE8300 (package) + DISP2_SUNXI framebuffer","negative_test":"appended line to config correctly fires","workflow_run":"32561575932 success on 178692b"}}
{"run":16,"commit":"b552666","metric":1,"metrics":{"build_minutes":1},"status":"keep","description":"Completed boot.img integrity: now also verifies the ramdisk.gz is embedded at its page-aligned offset (previously only the kernel was checked). Also established the committed partitions/boot_package.fex is the OTA-signature fallback, while the flashed image uses the build-regenerated copy. Green.","timestamp":1787386652546,"segment":1,"confidence":null,"asi":{"hypothesis":"boot.img integrity was incomplete (kernel only, no ramdisk)","finding":"ramdisk.gz byte-matches at Android page-aligned offset 13033472; kernel+ramdisk both verified","structural":"flashed image uses build-regenerated ../../a133-boot-packages/*.fex; committed partitions/boot_package.fex is the OTA-signature fallback","workflow_run":"32561806739 success on 7667b2e"}}
